URL,Content,Meta_Title,Meta_Description,Tokenized_Content,Tokenized_Meta_Title,Tokenized_Meta_Description,Meta_Title_Length,Meta_Description_Length,Content_Word_Count,Website
https://www.ign.com/wikis/baldurs-gate-3/How_to_Multiclass,join checklist map task search multiclass em stonham brandon rad lynette guzman 28 updated aug 28 2023 multiclassing let train multiple class granting customization build want experiment creating powerful combination class bg3 provide everything need know multiclass advertisement multiclassing everything need know play ign prep 6 42 autoplay setting everything need know play ign prep multiclassing allows build combination one class instead leveling class able level different class expense higher level class feature would continued level initial class level maximum level 12 character multiclassing level multiple class add 12 example could start playing druid first two level multiclass monk remaining ten level would multiclassing level 12 level 2 druid level 10 monk combined advertisement level one class time also allows alternate class level level screen class combining multiclass switch example start druid level 1 take monk next level go back druid next level learn class subclass plan combination class would want multiclass experiment different build also take consideration ability companion party member would work well together rule thumb best choose class prioritize stats example quintessential bardlock bard warlock sorlock sorcerer warlock charisma cast check class page breakdown class attribute access multiclassing multiclassing available reach level 2 level screen preview feature available next level starting class level box left find button class symbol hover button select add class take class option choose customize subclass class feature page existing class level also displayed corresponding class icon including many level class change mind want stay initial class select cancel return back previous menu advertisement beyond level 1 still multiclass current without starting respeccing see changing multiclass build also joining multiplayer campaign party level 2 higher able multiclass level party changing multiclass build advertisement multiclassing fun experiment build sometimes might working party composition worry always respec start multiclass build change class need find withers able change class cost 100 gold check find withers respec class detail take back level 1 customize initial class able level back whatever level reached follow multiclass instruction change build next unlock recruit hireling previous magic mirror change appearance next unlock recruit hireling top section beginner essential tip trick walkthrough thing first thing tell helpful leave feedback iii larian studio jul 29 2023 playstation 5 xbox series x pc macintosh stadium rate related guide overview beginner essential tip trick walkthrough thing first review editor column news guide watch guide elden ring dlc interactive map gta 5 cheat preorders ign store howlongtobeat deal contact u ign youtube ign tiktok ign twitter map genie,multiclass iii ign,multiclassing let train multiple class granting customization build want,"['join', 'guide', 'checklists', 'maps', 'task', 'search', 'multiclass', 'em', 'stonham', 'brandon', 'rad', 'lynette', 'guzman', '28', 'updated', 'aug', '28', '2023', 'multiclassing', 'baldur', 'gate', '3', 'lets', 'train', 'character', 'multiple', 'classes', 'granting', 'customization', 'build', 'want', 'experiment', 'creating', 'powerful', 'combinations', 'classes', 'bg3', 'guide', 'provide', 'everything', 'need', 'know', 'multiclass', 'advertisement', 'multiclassing', 'baldur', 'gate', '3', 'everything', 'need', 'know', 'play', 'ign', 'game', 'prep', '6', '42', 'autoplay', 'setting', 'baldur', 'gate', '3', 'everything', 'need', 'know', 'play', 'ign', 'game', 'prep', 'multiclassing', 'allows', 'build', 'character', 'combination', 'one', 'class', 'instead', 'leveling', 'class', 'able', 'level', 'different', 'class', 'expense', 'higher', 'level', 'class', 'features', 'would', 'get', 'continued', 'level', 'initial', 'class', 'baldur', 'gate', '3', 'level', 'maximum', 'level', '12', 'characters', 'multiclassing', 'levels', 'multiple', 'classes', 'add', '12', 'example', 'could', 'start', 'playing', 'druid', 'first', 'two', 'levels', 'multiclass', 'monk', 'remaining', 'ten', 'levels', 'character', 'would', 'multiclassing', 'level', '12', 'level', '2', 'druid', 'level', '10', 'monk', 'combined', 'advertisement', 'level', 'one', 'class', 'time', 'also', 'allows', 'alternate', 'class', 'level', 'level', 'screen', 'classes', 'combining', 'multiclass', 'switch', 'example', 'start', 'druid', 'level', '1', 'take', 'monk', 'next', 'level', 'go', 'back', 'druid', 'next', 'level', 'learn', 'classes', 'subclasses', 'plan', 'combinations', 'classes', 'would', 'want', 'multiclass', 'experiment', 'different', 'builds', 'also', 'take', 'consideration', 'abilities', 'companions', 'party', 'members', 'would', 'work', 'well', 'together', 'rule', 'thumb', 'best', 'choose', 'classes', 'prioritize', 'stats', 'example', 'quintessential', 'bardlock', 'bard', 'warlock', 'sorlock', 'sorcerer', 'warlock', 'use', 'charisma', 'cast', 'check', 'classes', 'page', 'breakdown', 'class', 'attributes', 'access', 'multiclassing', 'multiclassing', 'available', 'character', 'reaches', 'level', '2', 'level', 'screen', 'preview', 'features', 'available', 'next', 'level', 'starting', 'class', 'level', 'box', 'left', 'find', 'button', 'class', 'symbol', 'hover', 'button', 'select', 'add', 'class', 'take', 'class', 'options', 'choose', 'customize', 'subclass', 'class', 'features', 'page', 'existing', 'class', 'level', 'also', 'displayed', 'corresponding', 'class', 'icon', 'including', 'many', 'levels', 'class', 'change', 'mind', 'want', 'stay', 'initial', 'class', 'select', 'cancel', 'return', 'back', 'previous', 'menu', 'advertisement', 'beyond', 'level', '1', 'still', 'multiclass', 'current', 'character', 'without', 'starting', 'respeccing', 'see', 'changing', 'multiclass', 'build', 'also', 'joining', 'multiplayer', 'campaign', 'party', 'level', '2', 'higher', 'able', 'multiclass', 'character', 'level', 'party', 'changing', 'multiclass', 'build', 'advertisement', 'multiclassing', 'fun', 'experiment', 'builds', 'sometimes', 'might', 'working', 'character', 'party', 'composition', 'worry', 'always', 'respec', 'character', 'start', 'multiclass', 'build', 'change', 'class', 'need', 'find', 'withers', 'able', 'change', 'class', 'cost', '100', 'gold', 'check', 'guide', 'find', 'withers', 'respec', 'class', 'details', 'take', 'back', 'level', '1', 'customize', 'initial', 'class', 'able', 'level', 'back', 'whatever', 'level', 'reached', 'follow', 'multiclass', 'instructions', 'change', 'build', 'next', 'unlock', 'recruit', 'hirelings', 'previous', 'magic', 'mirror', 'change', 'appearance', 'next', 'unlock', 'recruit', 'hirelings', 'top', 'guide', 'sections', 'beginner', 'guide', 'essential', 'tips', 'tricks', 'walkthrough', 'things', 'first', 'things', 'baldur', 'gate', '3', 'tell', 'guide', 'helpful', 'leave', 'feedback', 'guide', 'baldur', 'gate', 'iii', 'larian', 'studios', 'jul', '29', '2023', 'playstation', '5', 'xbox', 'series', 'x', 'pc', 'macintosh', 'stadia', 'rate', 'game', 'related', 'guides', 'overview', 'beginner', 'guide', 'essential', 'tips', 'tricks', 'walkthrough', 'things', 'first', 'reviews', 'editor', 'columns', 'news', 'guides', 'watch', 'guides', 'elden', 'ring', 'dlc', 'interactive', 'map', 'gta', '5', 'cheats', 'preorders', 'ign', 'store', 'howlongtobeat', 'deals', 'contact', 'us', 'ign', 'youtube', 'ign', 'tiktok', 'ign', 'twitter', 'map', 'genie']","['multiclass', 'baldur', 'gate', 'iii', 'guide', 'ign']","['multiclassing', 'baldur', 'gate', '3', 'lets', 'train', 'character', 'multiple', 'classes', 'granting', 'customization', 'build', 'want']",18,72,412,www.ign.com
https://www.thegamer.com/baldurs-gate-3-bg3-multiclass-explained-how-to/,menu sign trending thegamer goty 2024 indiana jones great circle infinity nikki podcast event release date multiclass ryan thompson bamsey updated jan 13 2024 follow like link copied clipboard sign thegamer account multiclass play video article part directory complete walkthrough table content quick link multiclassing multiclass one greatest joy crpg like tinkering build experimenting different level option turning character highly optimised fighting machine specialized unique role add ability multiclass mix access entirely new world optimization experimentation 5 32 related owlbear cub bg3 ups stake allowing player owlbear cub camp obtain half bear half owl creature multiclassing staple dungeon dragon allowing mix match feature multiple class combination classic famed sorcadin paladin sorcerer power way potential combination bit updated january 13 2024 need help multiclassing included video version help juggle multiple class added detail process work two class multiclassing multiclassing baked right level system soon enough experience boost next level opt multiclass thing keep mind multiclassing automatically grant proficiency normally granted new class starting hp based class spend first level good idea pick class higher hit die first level unless second class proficiency require build class level separately image example level monk level 1 cleric mean despite enough experience four level power ability level monk level 1 cleric generally speaking multiclass build trade raw power single class versatility multiple class lead versatile well rounded often able perform single class role efficiently one multiclass impactful come spellcasters fall behind spell progression multiclass multiclass play video actually multiclassing simple process click level button brought level screen page give overview level button top right hover labelled add class clicking add class button bring new menu filled every class select one gain level class got one class level screen present class level allowing quickly click check gain taking level either screen also add class button allowing create three even class unlike tabletop version dungeon dragon stat requirement multiclassing class combination matter ineffective would technically possible create single level every single class provided take new class level 12 even achievement leave terribly unoptimised next every playable class two year early access let take look class choose previous change class respec complete walkthrough next every feat triple game follow like share recommended every feat need handy reference feat got covered aug 2023 player attempting frodo challenge wish ring never come 5 day ago player uncovers brutal act 1 revenge scene mother vengeance 2 day ago fromsoftware announces new co op 2025 elden ring nightreign fromsoftware even appears feature nameless king dark soul 4 20 hour ago 4 26 dragon age veilguard combat seems better companion fall dragon age veilguard companion character change act battle depending choice take 1 day ago indiana jones great circle every main voice actor indiana jones great circle throw idol throw voice actor indiana jones great circle day ago trending kadokawa much fromsoftware people really weird ciri design witcher 4 award self aware ever hypocritical join team audience u press event contact u follow u advertising career term privacy policy thegamer part valnet publishing group copyright 2024 valnet inc,multiclass,multiclassing allows interesting versatile downright overpowered class combination,"['menu', 'sign', 'trending', 'thegamer', 'goty', '2024', 'indiana', 'jones', 'great', 'circle', 'infinity', 'nikki', 'podcast', 'events', 'release', 'dates', 'baldur', 'gate', '3', 'multiclass', 'ryan', 'thompson', 'bamsey', 'updated', 'jan', '13', '2024', 'follow', 'like', 'link', 'copied', 'clipboard', 'sign', 'thegamer', 'account', 'baldur', 'gate', '3', 'multiclass', 'play', 'video', 'article', 'part', 'directory', 'baldur', 'gate', '3', 'complete', 'guide', 'walkthrough', 'table', 'contents', 'quick', 'links', 'multiclassing', 'multiclass', 'one', 'greatest', 'joys', 'crpg', 'like', 'baldur', 'gate', '3', 'tinkering', 'build', 'experimenting', 'different', 'level', 'options', 'turning', 'characters', 'highly', 'optimised', 'fighting', 'machines', 'specialized', 'unique', 'roles', 'add', 'ability', 'multiclass', 'mix', 'access', 'entirely', 'new', 'worlds', 'optimization', 'experimentation', '5', '32', 'related', 'baldur', 'gate', '3', 'get', 'owlbear', 'cub', 'bg3', 'ups', 'stakes', 'allowing', 'players', 'owlbear', 'cub', 'camps', 'obtain', 'half', 'bear', 'half', 'owl', 'creature', 'multiclassing', 'staple', 'dungeons', 'dragons', 'allowing', 'mix', 'match', 'features', 'multiple', 'classes', 'combinations', 'classics', 'famed', 'sorcadin', 'paladin', 'sorcerer', 'powers', 'way', 'potential', 'combinations', 'bit', 'updated', 'january', '13', '2024', 'need', 'help', 'multiclassing', 'included', 'video', 'version', 'guide', 'help', 'juggle', 'multiple', 'classes', 'added', 'details', 'process', 'works', 'two', 'classes', 'multiclassing', 'multiclassing', 'baked', 'right', 'baldur', 'gate', '3', 'level', 'system', 'soon', 'enough', 'experience', 'boost', 'next', 'level', 'opt', 'multiclass', 'things', 'keep', 'mind', 'multiclassing', 'automatically', 'grant', 'proficiencies', 'normally', 'granted', 'new', 'class', 'starting', 'hp', 'based', 'class', 'spend', 'first', 'level', 'good', 'idea', 'pick', 'class', 'higher', 'hit', 'die', 'first', 'level', 'unless', 'second', 'class', 'proficiencies', 'require', 'build', 'class', 'levels', 'separately', 'image', 'example', 'character', 'level', '3', 'monk', 'level', '1', 'cleric', 'means', 'despite', 'enough', 'experience', 'four', 'levels', 'powers', 'abilities', 'level', '3', 'monk', 'level', '1', 'cleric', 'generally', 'speaking', 'multiclass', 'builds', 'trade', 'raw', 'power', 'single', 'class', 'versatility', 'multiple', 'classes', 'lead', 'versatile', 'well', 'rounded', 'often', 'able', 'perform', 'single', 'class', 'role', 'efficiently', 'one', 'multiclass', 'impactful', 'comes', 'spellcasters', 'fall', 'behind', 'spell', 'progression', 'multiclass', 'multiclass', 'play', 'video', 'actually', 'multiclassing', 'simple', 'process', 'baldur', 'gate', '3', 'click', 'level', 'button', 'brought', 'level', 'screen', 'page', 'gives', 'overview', 'level', 'button', 'top', 'right', 'hover', 'labelled', 'add', 'class', 'clicking', 'add', 'class', 'button', 'bring', 'new', 'menu', 'filled', 'every', 'class', 'game', 'select', 'one', 'gain', 'level', 'class', 'got', 'one', 'class', 'character', 'level', 'screen', 'present', 'classes', 'level', 'allowing', 'quickly', 'click', 'check', 'gain', 'taking', 'level', 'either', 'screen', 'also', 'add', 'class', 'button', 'allowing', 'create', 'character', 'three', 'even', 'classes', 'unlike', 'tabletop', 'version', 'dungeons', 'dragons', 'stat', 'requirements', 'multiclassing', 'baldur', 'gate', '3', 'character', 'use', 'class', 'combination', 'matter', 'ineffective', 'would', 'technically', 'possible', 'create', 'character', 'single', 'level', 'every', 'single', 'class', 'game', 'provided', 'take', 'new', 'class', 'level', '12', 'even', 'achievement', 'leave', 'terribly', 'unoptimised', 'character', 'next', 'baldur', 'gate', '3', 'every', 'playable', 'class', 'baldur', 'gate', '3', 'two', 'years', 'early', 'access', 'let', 'take', 'look', 'classes', 'choose', 'previous', 'change', 'classes', 'respec', 'baldur', 'gate', '3', 'complete', 'guide', 'walkthrough', 'next', 'every', 'feat', 'game', 'triple', 'games', 'baldur', 'gate', '3', 'follow', 'like', 'share', 'recommended', 'baldur', 'gate', '3', 'every', 'feat', 'game', 'baldur', 'gate', '3', 'need', 'handy', 'reference', 'guide', 'feats', 'baldur', 'gate', '3', 'got', 'covered', 'aug', '3', '2023', 'baldur', 'gate', '3', 'players', 'attempting', 'frodo', 'challenge', 'baldur', 'gate', '3', 'wish', 'ring', 'never', 'come', '5', 'days', 'ago', 'baldur', 'gate', '3', 'player', 'uncovers', 'brutal', 'act', '1', 'revenge', 'scene', 'baldur', 'gate', '3', 'mother', 'vengeance', '2', 'days', 'ago', 'fromsoftware', 'announces', 'new', 'co', 'op', 'game', '2025', 'elden', 'ring', 'nightreign', 'fromsoftware', 'even', 'appears', 'feature', 'nameless', 'king', 'dark', 'souls', '3', '4', '20', 'hours', 'ago', '4', '26', 'dragon', 'age', 'veilguard', 'combat', 'seems', 'better', 'companions', 'fall', 'dragon', 'age', 'veilguard', 'companion', 'characters', 'change', 'act', 'battle', 'depending', 'choices', 'take', '1', '3', 'days', 'ago', 'indiana', 'jones', 'great', 'circle', 'every', 'main', 'character', 'voice', 'actor', 'indiana', 'jones', 'great', 'circle', 'throw', 'idol', 'throw', 'voice', 'actors', 'indiana', 'jones', 'great', 'circle', '3', 'days', 'ago', 'trending', 'kadokawa', 'much', 'fromsoftware', 'people', 'really', 'weird', 'ciri', 'design', 'witcher', '4', 'game', 'awards', 'self', 'aware', 'ever', 'hypocritical', 'join', 'team', 'audience', 'us', 'press', 'events', 'contact', 'us', 'follow', 'us', 'advertising', 'careers', 'terms', 'privacy', 'policies', 'thegamer', 'part', 'valnet', 'publishing', 'group', 'copyright', '2024', 'valnet', 'inc']","['multiclass', 'baldur', 'gate', '3']","['multiclassing', 'allows', 'use', 'interesting', 'versatile', 'downright', 'overpowered', 'class', 'combinations', 'baldur', 'gate', '3']",10,82,505,www.thegamer.com
